comment_id,parent_id,comment_author,comment_body,comment_score
lleymen,,kopibot,"Honestly, I don't think their pizzas taste better than the incumbents in Singapore i.e. Pizza Hut and Dominos.

They are, however, significantly cheaper and good enough for those who are okay with the occasional binge session.

I'm just sad that cheese, like all imported ingredients, is marked up in cost which makes it harder for any f&amp;b product w/ cheese to stay competitive relative to stuff w/o cheese. This is only made worse by locals generally treating all things cheesy as nice-to-haves rather than highly preferred or must-haves.",1
llf13cm,,ParkingFerret3928,"My family did either delivery or takeaway from the West Coast Plaza outlet at least once per month. 2 pepperoni and 1 cheese pizza would feed the 4 kids, helper wife &amp; I. Not the best pizza, but well worth the price.",1
llf28vh,,velvetstigma,Their cheese stuffed crust Pepperoni is the best in sg I've ever had. And super cheap too. Wanted to order last week but realised the Holland branch is gone. Sad to see this go.,1
llf55kf,,KeonXDS,"""For now""",1
llf5wot,,Khanwh,Oh Noooo 😢,1
llf92xu,,olsomica,"good pizza at decent price. but poor, poor service. what a shame",1
llfaele,,KaizerDuszel,Shit,1
llfbu27,,2ddudesop,NOOOOOOOOOOOOOOOOOOO!!!!!!,1
llfd9gn,,Difficult_Rabbit_234,"oh no... sobs, so many fnb businesses are not working out",1
llfe87r,,hazmat_beast,Man that sucks i like ceasars pizza,1
llff2ev,,iam_kayh,Oh man :/ I have had my first and only Little Caesars 2 - 3 years ago at Paya Lebar and now I wished I ate more of it since then. It was so good and affordable! Gonna miss you guys,1
lle5joc,,Accomplished-Wave426,I really wanted to buy but they didnt have branches in the east.,0
llejp88,,Brikandbones,"Honestly I thought their pizza was pretty shit frankly.

Value, yes, but I could treat my taste buds better.",1
lleg6mj,,596989,"Sad to see them leave 
They needed more outlets and better marketing",1
llejl2m,,starseeo,oh this is sad news. its our go-to food whenever we have any family gatherings. the kids love the stuffed crust.,1
llekpqf,,ponkanpinoy,Damn apparently I'm one of the few that thinks their pizza tastes like cardboard haha,-1
lle9ux7,,burnburnfirebird,Should have waited till 15th march,0
llfdheh,lle9ux7,PavanJ,Et tu /u/burnburnfirebird ?,1
lle9btq,,Remitonov,"I remembered their store in Holland Village. It had a prime location, but the store had always been rather empty. Any idea why they failed?",0
lleqhx3,lle9btq,jardani581,im guessing marketing issue,3
lle5jpj,,Hunkfish,Nice bit but the pepperoni too salty.,-2
llectcf,,ShallotHolmes,Noooooo I will remember you,0
lled0q2,,Fluffy-Scholar-1686,Ouch,0
llf0a1x,,Karoliner-Provost,I didn’t even know they had an outlet here in Singapore,0
llfcjo5,,nooberwin32,"Essentially one of the few fast food pizza chains that didn't stoop to adding sugar to their sauce to appease weak tongued sinkies, and they paid the price.",1
llem7yt,,000010TEN,Hopefully they come back as halal certified. Was never able to try it because it's not halal and a lot of my non Muslim friends loved it.,-5
llezqa6,llem7yt,Ok_Machine_724,"A big draw was that they used pork pepperoni, which you can't otherwise find in large halal pizza chains like Pizza Hut or Dominos. Doing this is likely to throw a large portion of their fans off.",3
lle55vs,,Iselore,The breadstick style crust is nasty.,-7
llemqbx,,imivan111,Should have made the pizza cheaper and not charged for sauces.,-1
llex7ir,,pieredforlife,The crust is too thick,-1
llf0sp3,,balajih67,Never really liked it. Dominos is much better. But india dominos obliterates singapore fast food pizza chains.,-1
