comment_id,parent_id,comment_author,comment_body,comment_score
lle8zq5,,Holy_Beergut,"There used to be an outlet in Thomson Plaza. I think their large pepperoni pizza was like $8 iirc and I could eat it for 2 meals, so was quite value for money.

I did my part and ate it fairly regularly but they eventually shut down, was sad to see it go.",119
lleh974,lle8zq5,LORD-SOTH-,"I also used to patronise the outlet at Thomson Plaza regularly .

Much cheaper than the overpriced Pizza Hut restaurant, which BTW also recently closed down ( together with KFC), in Thomson Plaza.

I am not surprised that Ceasars Pizza collapsed.
The outlet at Ang Mo Kio started rejecting credit card payments a couple of months ago, on the flimsy excuse that their credit card machines were not working , and accepted cash only.

It was just a BS excuse to reduce their financial costs.

Bottom line is they became desperate as a business entity and tried all sorts of ways to reduce costs . 
The signs of impending doom were all there .",56
llek5l1,lleh974,Holy_Beergut,"Yeah, I live within 10 mins walking distance of Thomson plaza, so go there regularly. As you said, up until it closed down, Pizza Hut was the only other pizza place in Thomson plaza to get my pizza fix if needed. 

There is also another pizza place, not in Thomson plaza but nearby, but they're more expensive, and the type of pizza they have is thin crust so I'm not a fan.

On another note, and just a small rant. After Pizza Hut and KFC closed down at Thomson Plaza. I was wondering what eatery would open up to take its place. Turns out, it was Sushiro. 

I was definitely not expecting it to be another japanese restaurant, considering that Thomson Plaza is already over-saturated with japanese restaurants in my opinion (Before Sushiro opened last month, there were already 6-7 other Japanese F&amp;Bs in operation)

I guess can't blame the Thomson Plaza management too much as they probably only care about getting a new tenant asap. But I wonder what was in Sushiro's mind when they decided to open an outlet in Thomson Plaza, assuming they did their market research and knew how many other japanese restaurants already existed there.",19
lleqctb,llek5l1,yapyd,"When there are 6-7 Japanese restaurants and they are surviving or even possibly thriving, that generally means there's a big enough demand in the area for it. If sushiro is able to beat out the other restaurants, they would monopolise the market for themselves. ",10
llf0ey7,llek5l1,Joshteo02,"If yall still want cheap pizza, coupon code 706769 in domino's app gives 5 dollars pizza",9
llf6fxp,llek5l1,AdUnfair7713,"Well I mean if you've walked into the pizza hut branch at Thomson plaza, you would notice that it was always empty. It did take tons of delivery orders but that volume must not have been enough to keep it going. Compare that with Sushiro. It opened a while ago only but it already has queues at lunchtime and dinner time. I guess the demand for Japanese food in the area is just much higher than that for pizza. I love Japanese food, but also at the same time a bit sian that there's so many Japanese restaurants at Thomson Plaza haha

By the way if you're craving pizza, there's a tiny Dominos nearby heh",3
llf26gg,llek5l1,bargeboards,"&gt;But I wonder what was in Sushiro's mind when they decided to open an outlet in Thomson Plaza, 

There was already a Sushiro and it was successful before it became Omote. J/K I know it's a completely different entity but I wonder about the backstory.",2
llfa0lh,llek5l1,aktivate74,The kfc/PH side of Thomson plaza is strata.,1
llfbenz,lleh974,rowgw,"What, Pizza Hut and KFC there also got shutdown? Hope not because of REIT increase the lease significantly",1
llejavl,lle8zq5,Sweaty_Passage_6456,Why ah shut down?,1
llel4sj,llejavl,Holy_Beergut,"Your guess is as good as mine. But not making enough money is usually the reason in most cases, or maybe their tenancy was expiring and the new rent was too high.",3
llfafjt,llel4sj,nganmatthias,"Could be the developer didn't want to renew the tenancy too, and wanted something that would bring in more footfall.",1
llfa7by,llejavl,aktivate74,Rental.  From what I heard that half of TP is owned by NTUC and since they revamped the place (circa 2020?) rentals kept going up.,1
lleb60e,,yojallec,"THIS IS DEVASTATING. The only affordable delicious bang for your buck pizza is closing :(

I LOVE LITTLE CAESARS AND HAVE IT ALL THE DAMN TIME",77
llenq27,lleb60e,ttgkc,Well looks like you didn’t have it enough welp,13
lles1os,lleb60e,askmypen,Tenderfresh also quite good,-5
lle809f,,skatyboy,"As for those wondering why “cheap still cannot attract enough business”, pizza isn’t really a staple here, unlike in Western countries (especially US). 

Hence, the volume isn’t going to be enough as compared to the US, where even in low density suburbs, high rents and $20/hr minimum wage, it’s still turning a profit and there’s multiple cheap pizza places for like 200k population. Where I stay in the US, I can count like 20 pizza shops in a radius of 3km and the population in that “radius” isn’t even 100k (low density suburbia).

A lot of people in the US eat pizza like we eat hawker food.",328
lle8k2x,lle809f,Toyboyronnie,There's pizza hut and dominors everywhere. Canadian pizza. Spizza or whatever.  I think it's more a lack of marketing and lack of halal.,94
llebdyw,lle8k2x,skatyboy,"Those are expensive so they can profit with less sales. Doubling the price with same expenses (not like the other chains use higher quality ingredients for their pizzas) means you can sell half to break even. Think 100 vs 50 pies a month. Think 5% market share to profit vs 10%.

If you look at hawkers you do see a lot of non-halal hawkers that are still making bank, despite the ridiculous rents (especially for popular centers), so I don’t think it is a big factor if price was actually the way to gain a profitable share in the market.

Also the level of pizza obsession isn’t crazy in SG, yes, a lot of outlets, but not like 1 store for every 5k people.",36
llecu5s,llebdyw,RIMBarisax,"I feel like it’s a bit different for pizza because pizza tends to be food for big group events or activities where the demand for halal food is going to be stronger, vs hawkers where you’re either on your own or in small groups or if you have Muslim people there, they can buy from other stalls",31
lled961,llecu5s,skatyboy,"That’s the problem, in the US, it’s not “big group event food”, it’s literally lunch for a group of people working. It’s lunch for after school practice.

There’s more sales overall per capita, compared to SG where the average weekday isn’t pizza for lunch.

It might have been a factor but overall, I don’t think the volumes would support that price point in the first place.

There are also non-halal “group food”, like hotpot (e.g. HDL) or zichar, that are making bank in SG despite the lack of halal certification. Pizza in the States is like HDL/zichar for us, group food but not only catering/event kind of food.

Conversely, even in Malaysia (where halal is a large factor and cuisines are almost similar), their pizzas are also expensive relative to wages there.

Makes me think it’s just incompatible cuisines + higher overhead (e.g. cheese is expensive), like selling spicy food in a country where people don’t eat spicy food often and spices are expensive.",35
llemcqr,lled961,Mochiron_samurai,"making bank in SG despite the lack of halal certification 

They’re making bank precisely because they’re not halal certified. Once it becomes halal it loses its core customer base.",18
llejz04,lled961,JLtheking,"Pretty much. In the US you can grab a slice of pizza for like $3 at your local deli and that would just be your lunch. It’s basically their fast food cheap cai png that everyone eats by default. A “healthier” option like a sandwich goes for far more. 

Singaporeans just don’t buy pizza by the slice as a matter of habit (and places that do sell it very expensive), so that actually cuts a lot out of a pizza place’s profit margins.",8
llf6aff,llejz04,Fakerchan,"Hmm depends , dominos sell reg pizza at 5$ tho",0
llf7059,llf6aff,JLtheking,"Yeah but it’s not fast food. You can’t just walk up to a counter, pick it up and leave. You gotta order in advance or sit down and wait and this is not really compatible with the kind of fast paced lunch culture we have here in sg. 

So as a result pizza is treated similarly to eating at a restaurant kind of affair. Only for special occasions instead of a staple food like cai png or McDonald’s.

When was the last time you as an individual ordered that $5 pizza just for yourself?",3
llf8r46,llf7059,Fakerchan,Ehh just last month lol. I have always eaten reg by myself. Speaking of which I might wanna get it again this weekend,1
lletpuc,llecu5s,According_Lab_6907,wait you guys eat pizza in groups?,1
llf0ubl,lle8k2x,bitflag,"Them serving pork is one reason I actually ordered there. Tired of meat lovers with ""chicken ham, chicken sausage and turkey bacon"" from the other chains.",5
llfctyu,lle809f,nooberwin32,"That isn't why, it's because it's cheese and sg can't handle dairy. It's why people think saizeriya is good too and half of the ""cheese"" whatever foods you eat in singapore is edible plastic loaded with sugar.",1
llejpom,lle809f,chrimminimalistic,"Also.... their pizza kinda sucks. 

Honestly, the dough can't even match Dominos.

Domino's is kinda low bar in case you don't know.",-6
llfcf2s,llejpom,mosakuramo,Not sure why you are being downvoted. It really isnt very good.,1
llen6qh,llejpom,AYYYWRONGBODOH,"yea its like worse than bread somehow, so stale and dry",-1
lle68my,,ShibaInuWoofWoof,"I guess we took their cheap pizzas for granted and didn't eat enough. Their pizzas are so value for money unlike the key players.

11.90 box of Pepperoni could last me an entire day, what a cost saver.

Oh well, back to Canadian Pizza for value for money pizzas!",271
lle9vu7,lle68my,lesarbreschantent,My family did our part.,33
llee87z,lle68my,Hakushakuu,I'd rather eat pizza bread than Canadian pizza wth.,52
llen4sh,lle68my,crasyeyez,"Dominos still does $5 pizzas when you enter their discount code, which changes every month but is on their IG.",8
llexoir,llen4sh,General_Guisan,"706769 - same code basically for 2 years.. ignore the monthly changing one, use the forever 5$ one :-)",10
lle92q1,,Antique-Pie360,NOOO this is the best fast food pizza by such a long shot. Dammit man,87
lle3qt9,,Creative-Macaroon953,Thought r/sg always recommend this as one of the best? How come close down,107
lle6u62,lle3qt9,George_W_Bushido,"Fortunately, this echo chamber isn't a representation of real life",167
llecutf,lle6u62,SG_wormsblink,"Yeah I noticed everytime some business is promoted here, it’s actually bad / not worth the hype.

Maybe the brands are running stealth marketing campaigns by pretending to be customers.",24
lleit3e,llecutf,tm0587,"I tried it once and never had it a second time. Didn't find it to be a good pizza imo, nothing to do with price for me.",3
lleu3fb,lleit3e,jrgnklpp,"What didn't you like though? The pizza dough and tomato base is far far better than any local pizza chains at a fraction of the cost. It's not restaurant standard of course, but not overrated by reddit at all.",6
llewsad,lleu3fb,tm0587,"The tomato base and pizza dough are both pretty good, I'll give you that, but the cheese and toppings are underwhelming to me. I rather just buy pizza hut, domino etc.",2
lleydya,llewsad,jrgnklpp,Hmm fair enough I suppose it's really a matter of preference. Bad pizza dough just ruins the whole pizza for me.,2
lleeec9,lle6u62,discoverlifekk,"Upvoting this
Anything that is disagreed in Reddit get downvoted  relatively fast.",3
lle4jcq,lle3qt9,freshcheesepie,Too cheap,11
lleky2j,lle3qt9,A-Chicken,Sadly we have too many people who don't eat pizza and view it as a junk food. Same problem with pasta here really...,4
lleylne,lleky2j,Ok_Machine_724,"Pizza, at least the way it is made now, is junk food. Extremely high in carbs and fat and low in protein, and usually with toppings that are processed foods or very heavily seasoned.",11
llettqa,lleky2j,jrgnklpp,It is junk food no?,3
llfclpp,lleky2j,PavanJ,Pizza is junk food.,1
llebsrq,lle3qt9,opoeto,Can’t cover rent lo,2
llfdqnf,lle3qt9,mosakuramo,Because it isnt very nice...,1
llea5gi,,katsuge,Amazed that pezzo is still around..,44
llep37q,llea5gi,holybommie,"cause its under NTUC group i think, can earn link points

edit: oh wait, i just googled, singapore owned ""kiosk collective"" got crave",4
llee6il,llea5gi,micxiao,The one at Nex closed down 😕,6
lleem9s,llee6il,katsuge,I think it's just a matter of time for all the other stores..always seen them without any queues. It is really not in our culture to takeaway pizza slices for meals,10
lleik1d,llea5gi,infernoxv,pezzo is halal and therefore crap,22
lleop40,lleik1d,Mochiron_samurai,"Pezzo is indeed crap, but being halal is just a small part of it",18
llfd0ds,lleik1d,nooberwin32,"There's a bunch of good halal pizza, what are you on about.

If you want to blame any group it's people here who can't handle dairy.",1
llen1wc,lleik1d,Pok3dab,nah man thats a wild and horrible take,-3
llemf56,lleik1d,OxySempra,"That’s a wild generalisation, but you do you man",-11
llen2hm,llemf56,infernoxv,"simply put, all the halal substitutes for pork pepperoni and salami taste dreadful and are a pale substitute if one has had the real thing.",29
llenxhh,llen2hm,OxySempra,"I would argue that this is a subjective statement, rather than an objective one. It is ultimately up to personal preference if ‘the real thing’ is that much better than the ‘dreadful’ substitute. 

In any case, I am on the camp that more of the magic lies in the cooking process than on the ingredients. Leaving aside the pork matter, at least we can both agree that Little Caesars has horrible dough yeah?",-3
llerb6x,llenxhh,hayashikin,"Given a choice I'd always prefer the original ingredients than a substitute.

Pepperoni and Salami are great examples, I'm also pretty sure it'll be hard to find someone who prefers something like turkey bacon over real bacon. Some stuff like Prosciutto are so hard to replace.",10
llese0g,llerb6x,Orangecuppa,Turkey bacon is a terrible invention. It's pretty much cardboard and should not be taken seriously.,10
lleu1ap,llese0g,hayashikin,"Agreed, the taste and texture are utterly different, could argue that some recipes would be better just taking it out.

Same thing for Acesulfame K as a sugar substitute, the aftertaste makes everything so different, I'm really hoping more brands can just offer lower sugar versions of drinks without adding anything else.",3
llez0z3,llenxhh,Ok_Machine_724,"Subjective?

Bro have you tried chicken and turkey bacon? Those are abominations compared to the real thing.",4
llepa26,llemf56,fish312,Any halal ramen I've ever tried has been absolutely garbage,12
llesmhk,llepa26,Orangecuppa,"I can't think of any halal 'Hainanese' chicken rice that's nice. 

It's always either rice too wet, or chicken too much maggi soy sauce flavor.",4
llf6z3u,llea5gi,cheetahound,Why does this shit stay and the best has to go,2
ller05k,,taromilklatte,god please take pezzo and leave little caesar’s alone 😭🙏,22
llexpuh,ller05k,yagrain,Ewww Pezzo,3
lledww7,,FridaCalamari,"He came, he saw, but he couldn't conquer.",19
lle8gur,,banned_salmon,What a terrible way to start the day.,17
lle58ef,,TheFearlessCow,NOOOOOOOOOOO,35
lleajkw,,sykortik,"My family's preferred pizza. So sad that it's gone. 

Hope it's a ""see you later"" rather than ""goodbye"".",32
lle37p1,,wyrmcrypt,That sucks. One of the few places to get an alright pizza with actual pork pepperoni and bacon.,106
llee3ry,lle37p1,haruharu1,"This! As someone who doesn’t eat beef, most fast food pizza places replace the meat pizzas with beef slices. Understand it’s to make it halal friendly, but I will miss cheap pork pepperoni pizzas 😢",26
lle5jaq,,rowgw,WHYYYYY???? 😭,25
lleausd,,cheesesauceboss,"Big shame - huge fan of LC. Price, quality and taste similar to the states. They had 7 fairly large outlets in prominent locations, maybe that was a factor. I know franchisors are not really your friend and they may have had a contractual obligation to scale fast and wide. I think it would have done better having smaller locations in the heartlands and focus on online and delivery like Canadian Pizza. Big shame as fast casual pizza here is not good and good to great pizza is pretty expensive.",27
lled39i,,bedouinchic,I really enjoyed their pizza ever since they debuted in Singapore a few years ago. Too bad they couldn’t sustain their business model. I don’t really like Dominos or Canadian pizza. Pizza Hut is okay only. I think I’ll give Spizza another shot.,11
lle2skn,,Reddy1111111111,This is sad. Always wanted to buy never got the chance to try due to their locations,38
lle80q0,lle2skn,invigo79,Haha exactly the same reason as mine. There is no nearby outlet.,9
lle3ze8,,urcommunist,That's a bummer. Shall grab some today.,32
lle4zm6,lle3ze8,Cute_Meringue1331,"Me too, impromptu pizza party 😂",7
lle8g4e,,Toyboyronnie,I'm gutted. Halal pizza is awful. Little Caesars had real pork pizzas at a fair price.,61
llej2ck,lle8g4e,AirClean5266,You can enjoy pork pizzas without putting down other religions,-47
llepfq5,llej2ck,fish312,Halal ramen sucks too.,27
llelzgs,llej2ck,KoishiChan92,"How is that putting down the religion? He's not saying the religion is awful, just that the Halal versions of pizza is. Pretty much everyone who has travelled agrees that our version of fast food chains pales in comparison to other countries where they aren't Halal.",34
lleonod,llelzgs,AirClean5266,"How is it not? Halal is associated with Islam, and making such a statement definitely doesn’t help make Muslims feel included in the community. “Ah your food is crap, I wish I could have my pork” is all I heard to be honest.",-33
llew8un,lleonod,Denvrado,Halal is associated with muslim but not liking halal food doesn’t mean they hate muslim. Just as much as you not liking vegetarian food doesn’t mean that you hate buddhism. Learn the difference between the two.,19
llewz1g,llew8un,AirClean5266,"Vegetarian food isn’t exclusive to any religion, halal is exclusive to Islam. You need to learn the difference. Not sure where I mentioned ‘they hate Islam’. You guys love coming up with your own conclusions.",-14
llexdp9,lleonod,KoishiChan92,"It's like saying ""vegetarian bee hoon isn't good"" isn't the same as ""vegetarians suck"", understand? They aren't saying all halal food sucks, they are saying that halal pizza specifically isn't good. Nothing to do with the religion and honestly if you immediately linked it to denouncing the religion then you obviously have too nice a life to be so easily offended.",7
llez8bd,lleonod,Ok_Machine_724,Why the fuck u so triggered bro? Chill can?,3
llf7p1v,lleonod,WangmasterX,"Does it hurt your feelings less if i said ""i wish i could have pork in foods supposed to have pork"" instead?",1
llelyv4,llej2ck,OxySempra,"It’s kind of crazy how there a few commenters here with that take. By all means, yeah you can lament that a non-halal pizza chain is closing down. But then you start to see people literally saying things to the effect of “if it’s halal, it’s therefore crap”. 

If it means this much to you, just go to a specialty deli store? For better or for worse, regardless of your opinions, 30% of the population here are Muslim. And it isn’t just the Muslims that don’t eat pork, a good subsection of Hindus don’t either. 

You don’t see those that can’t eat pork complaining that it is really hard or that there are very limited options for halal food around their estate or etc., but a low cost chain pizza brand goes down and people go crazy",-19
llexrs6,llelyv4,Varantain,"&gt; 30% of the population here are Muslim.

[15.6%](https://en.wikipedia.org/wiki/Islam_in_Singapore), not 30%.",6
llf0jqr,llelyv4,whateverish_ly,"Ha but you don’t see Hindus constantly complaining when stuff is halal and they happily serve beef, or even put beef stock in stuff and don’t say it contains beef - but god forbid anyone doesn’t enjoy halal food.

and lol people are constantly complaining that stuff isn’t halal, what are you talking about. at this point “halal?” On restaurant and food posts etc has become a passive-aggressive accusation, especially when it’s answered and people keep asking the same thing over and over again. 

Add to that the constant victim complex of so many Muslims who seem determined to carry the constant burden of being discriminated against for their religion, and you have guys like this overreacting wildly. Maybe people just don’t like halal food, and that’s fine.",5
lleeguh,,Pinkerino_Ace,"I remember they had a branch at Paya Lebar Singpost. Honestly, I can touch my heart and say LC has the best quality pizza for it's price range. I even prefer LC pizza compared to the other pizza franchise like pizza hut, domino, Canadian etc. 

Also, Pizza hut and Domino rarely have eat-in stores nowadays. They usually have a small corner kitchen just for deliveries.",13
llec159,,Darth-Udder,Maybe rental increase,6
lle8p9v,,LeanTim,Sad that the remaining pizza chains here don’t serve pork,27
llelk9n,lle8p9v,KoishiChan92,"I feel for our Muslim brethren having limited choices, but all the fast food places being Halal really is a little saddening because it's often not even done well, like the quality of Subway TANKED after going Halal.",23
llem89a,lle8p9v,Henrikandmymy,"Yes, ham, bacon, prosciutto, pepperoni, salami, and other forms.",5
lle8blq,,ranmafan0281,Maybe now Papa John's can finally come back.,10
lleiswh,,anklebiter552,aww such a shame 😓😓😓i thought their pizzas were quite good compared to other brands. (i tried it once when they had an offer),5
lleqijs,,sharkyneko,dam..I love their pork pizza..now I need to find another affordable one that sells pork,4
lle6q0e,,George_W_Bushido,Weird normally they go for halal certificate as a last ditch effort,7
lle8t72,lle6q0e,Remitonov,"I guess they didn't think it was necessary to get it, or that it was too expensive to make the transition. They'll probably go halal from the get-go if and when they restart their franchise here.",14
llf1fip,lle8t72,bitflag,"Not sure about that, when all the competition is halal, offering pork becomes a competitive advantage while the loss of potential consumers isn't that big anyway.",6
llebnhw,lle8t72,Windreon,It will affect the taste though.,12
llebkhg,lle6q0e,UncleJW,The main reason I bought from them was because of the availability of Pork Pepperoni.,20
llec5d2,llebkhg,George_W_Bushido,Yeah I mean there's plenty of halal pizza already available but often you do see restaurants try that first,3
llektjb,,Eseru,Shit. They weren't the best pizza but they were my favourite cheap pizza fix. Gonna eat some pizza this month ig,3
lleprqh,llektjb,fish312,What's your favorite pizza place,1
lleej7d,,heartglimpses,It’s a sad day… I really liked their tomato sauce and base.. as the other outlets shuttered one by one I thought that they would just hang on with the last outlet… but ended up like falling Domonio’s… Ha…,5
lleitzm,,infernoxv,if they come back as halal i will never buy from them again,5
llef1ls,,Material-Judge-6126,"Moving on to my next favourite pizza chain, Gopizza.",3
lleg0ib,,catlover2410,"In Singapore, pizza is mainly a dine-out, delivery purchase. Unless you aren't a purely pizza restaurant (e.g. gastrobar, Italian) your brand presence and recall will depend greatly on whether you offer islandwide delivery. When people do choose to eat out for pizza, they will either go to one that they know and are familiar with (from previous delivery orders), or have a variety of choices (both pizza and pasta).

Expect Gopizza to go bust too.",3
lleblpr,,qinggd,Good bye 👋 thanks for the food since covid till now,3
llela8m,,fluffyduckyp,"Noooooo my fav fast food pizza :( I knew they were closing down stores but I didn't think they were doing /that/ badly


I was very happy when they opened a branch at Singpost but honestly the QC is a bit whack and the Singpost one wasn't as nice as the Funan branch and then it evaporated anyway…",1
llemgrz,,Zenn00,"goodbye mr caesar, you will be missed. pizza pizza. 🫡😭",1
lleodzc,,BigFatCoder,"Me and my family like their pizza, it is sad to see them go.",1
lleoy8p,,idevilledeggs,"Damn :(

Little Caesar's was actually pretty solid for the price it sold at. Time to have a goodbye pizza party I guess.",1
llepvsh,,jardani581,"nyooooooo my favorite pizza place..

this is a catastrophe.

why did you have to leave us..",1
ller9tc,,ArchusKanzaki,I was actually abit bummed by this. They used to have store in Singpost Centre too that I sometimes go there to buy. But then they gradually winding down.... Their pizza is honestly just okay but their pricing is really damn value for something that big. I also really like their Crazy Bread. I can buy Stuffed Crust without buying an entire Pizza.,1
ller9xt,,whatsnewdan,They are caes-ing operations,1
llewjze,,thattanna,"Always wanted to try this but never really had a chance to. Welp, guess I'll try to visit it this month before they're gone.",1
